{
  "event_id": "1e39ee94-b7ce-4ea9-b018-a1a961fa19a1",
  "timestamp": "2026-05-07T08:02:00+00:00",
  "ingested_at": "2026-05-07T12:49:18.961841+00:00",
  "schema_version": "1.0",
  "source": {
    "component": "secureinfra",
    "tool": "prowler",
    "environment": "production",
    "cloud_provider": "aws",
    "region": "us-east-1",
    "account_id": "123456789012"
  },
  "event_type": "vulnerability",
  "severity": "medium",
  "title": "Ensure CloudTrail is enabled in all regions",
  "description": "AWS CloudTrail is a web service that records AWS API calls for your account and delivers log files to you. The recorded information includes the identity of the API caller, the time of the API call, the source IP address of the API caller, the request parameters, and the response elements returned by the AWS service.\n\nStatus: No multi-region CloudTrail trail is enabled in account 123456789012.\n\nRisk: Without multi-region CloudTrail, API activity in some regions may go unlogged, reducing visibility into account activity and making incident response harder.",
  "tags": [
    "cspm",
    "prowler",
    "aws",
    "cloudtrail",
    "medium"
  ],
  "payload": {
    "cve_id": null,
    "cwe_id": null,
    "affected_file": null,
    "affected_line": null,
    "affected_package": null,
    "affected_version": null,
    "fixed_version": null,
    "remediation": "Create a CloudTrail trail with multi-region logging enabled and store logs in a dedicated, access-controlled S3 bucket.",
    "references": [
      "https://docs.aws.amazon.com/awscloudtrail/latest/userguide/cloudtrail-create-and-update-a-trail.html",
      "https://docs.aws.amazon.com/awscloudtrail/latest/userguide/receive-cloudtrail-log-files-from-multiple-regions.html"
    ],
    "check_id": "cloudtrail_multi_region_enabled",
    "status": "FAIL",
    "status_extended": "No multi-region CloudTrail trail is enabled in account 123456789012.",
    "resource_id": "arn:aws:cloudtrail:us-east-1:123456789012:trail",
    "service": "cloudtrail",
    "risk": "Without multi-region CloudTrail, API activity in some regions may go unlogged, reducing visibility into account activity and making incident response harder.",
    "compliance": [
      {
        "framework": "CIS-AWS-Foundations-Benchmark",
        "version": "1.4",
        "requirements": [
          "3.1"
        ]
      }
    ],
    "finding_unique_id": "prowler-aws-cloudtrail_multi_region_enabled-123456789012-us-east-1"
  },
  "raw": {
    "Provider": "aws",
    "CheckID": "cloudtrail_multi_region_enabled",
    "CheckTitle": "Ensure CloudTrail is enabled in all regions",
    "CheckType": [],
    "ServiceName": "cloudtrail",
    "SubServiceName": "",
    "Status": "FAIL",
    "StatusExtended": "No multi-region CloudTrail trail is enabled in account 123456789012.",
    "Severity": "medium",
    "ResourceType": "AWS::CloudTrail::Trail",
    "ResourceId": "arn:aws:cloudtrail:us-east-1:123456789012:trail",
    "ResourceArn": "arn:aws:cloudtrail:us-east-1:123456789012:trail",
    "ResourceDetails": "",
    "Description": "AWS CloudTrail is a web service that records AWS API calls for your account and delivers log files to you. The recorded information includes the identity of the API caller, the time of the API call, the source IP address of the API caller, the request parameters, and the response elements returned by the AWS service.",
    "Risk": "Without multi-region CloudTrail, API activity in some regions may go unlogged, reducing visibility into account activity and making incident response harder.",
    "RelatedUrl": "https://docs.aws.amazon.com/awscloudtrail/latest/userguide/receive-cloudtrail-log-files-from-multiple-regions.html",
    "Remediation": {
      "Code": {
        "CLI": "aws cloudtrail create-trail --name acme-global-trail --s3-bucket-name acme-cloudtrail-logs --is-multi-region-trail",
        "NativeIaC": "",
        "Other": "",
        "Terraform": ""
      },
      "Recommendation": {
        "Text": "Create a CloudTrail trail with multi-region logging enabled and store logs in a dedicated, access-controlled S3 bucket.",
        "Url": "https://docs.aws.amazon.com/awscloudtrail/latest/userguide/cloudtrail-create-and-update-a-trail.html"
      }
    },
    "Categories": [
      "software_and_configuration_checks"
    ],
    "DependsOn": [],
    "RelatedTo": [],
    "Notes": "",
    "Compliance": [
      {
        "Framework": "CIS-AWS-Foundations-Benchmark",
        "Version": "1.4",
        "Requirements": [
          {
            "Id": "3.1",
            "Description": "Ensure CloudTrail is enabled in all regions"
          }
        ]
      }
    ],
    "Timestamp": "2026-05-07T08:02:00.000000",
    "AccountId": "123456789012",
    "Region": "us-east-1",
    "FindingUniqueId": "prowler-aws-cloudtrail_multi_region_enabled-123456789012-us-east-1",
    "MutedReason": ""
  }
}